{
  "$schema": "http://json-schema.org/draft-07/schema",
  "$id": "http://example.com/example.json",
  "type": "object",
  "title": "Product schema",
  "description": "A Dapr Store product",
  "required": [
      "id",
      "name",
      "cost",
      "description",
      "image",
      "onOffer"
  ],
  "additionalProperties": true,
  "properties": {
      "id": {
          "$id": "#/properties/id",
          "type": "string",
          "title": "The id schema",
          "description": "An explanation about the purpose of this instance."
      },
      "name": {
          "$id": "#/properties/name",
          "type": "string",
          "title": "The name schema",
          "description": "An explanation about the purpose of this instance."
      },
      "cost": {
          "$id": "#/properties/cost",
          "type": "number",
          "title": "The cost schema",
          "description": "An explanation about the purpose of this instance."
      },
      "description": {
          "$id": "#/properties/description",
          "type": "string",
          "title": "The description schema",
          "description": "An explanation about the purpose of this instance."

      },
      "image": {
          "$id": "#/properties/image",
          "type": "string",
          "title": "The image schema",
          "description": "An explanation about the purpose of this instance."
      },
      "onOffer": {
          "$id": "#/properties/onOffer",
          "type": "boolean",
          "title": "The onOffer schema",
          "description": "An explanation about the purpose of this instance."
      }
  }
}
